{
	"$schema": "http://json-schema.org/draft-07/schema#",
	"title": "SportSync – hva du følger",
	"description": "Din kilde til sannhet. Kun du redigerer denne — AI skriver aldri her.",
	"type": "object",
	"required": ["language", "timezone", "alwaysTrack", "interests"],
	"additionalProperties": false,
	"properties": {
		"$schema": {
			"type": "string",
			"description": "Fritekst-notat (ikke en skjema-URL). La stå."
		},
		"language": { "type": "string", "description": "F.eks. \"nb-NO\"." },
		"timezone": { "type": "string", "description": "F.eks. \"Europe/Oslo\"." },
		"alwaysTrack": {
			"type": "object",
			"description": "Konkrete ting du følger. Matches deterministisk på navn + aliaser.",
			"additionalProperties": false,
			"properties": {
				"athletes": { "type": "array", "description": "Utøvere du følger.", "items": { "$ref": "#/definitions/entity" } },
				"teams": { "type": "array", "description": "Lag du følger.", "items": { "$ref": "#/definitions/entity" } },
				"tournaments": { "type": "array", "description": "Turneringer/serier du følger.", "items": { "$ref": "#/definitions/entity" } }
			}
		},
		"notify": {
			"type": "object",
			"description": "Innstillinger for kalender-påminnelser.",
			"additionalProperties": false,
			"properties": {
				"leadMinutes": { "type": "integer", "minimum": 1, "description": "Hvor mange minutter før start du varsles. Standard 30." }
			}
		},
		"interests": {
			"type": "array",
			"description": "Fritekst-brief til research-agenten (tolkes av AI, matches ikke av kode).",
			"items": { "type": "string" }
		},
		"neverTrack": {
			"type": "array",
			"description": "Ting AI aldri skal spore.",
			"items": { "type": "string" }
		},
		"followBroadly": {
			"type": "array",
			"description": "Sporter som vises bredt på tavla selv uten en spesifikk tracket enhet.",
			"items": { "type": "string" }
		},
		"notes": { "type": "string", "description": "Fritt notat til deg selv / agenten." }
	},
	"definitions": {
		"entity": {
			"description": "En ting du følger. Kan være en enkel streng, men objekt-form (med aliaser + sport) matcher best.",
			"anyOf": [
				{ "type": "string" },
				{
					"type": "object",
					"required": ["name"],
					"additionalProperties": false,
					"properties": {
						"name": { "type": "string", "description": "Kanonisk navn, f.eks. \"Barcelona\"." },
						"aliases": {
							"type": "array",
							"description": "Andre navn/kortformer så matchingen treffer, f.eks. [\"FC Barcelona\", \"Barça\"].",
							"items": { "type": "string" }
						},
						"sport": {
							"type": "string",
							"description": "Sport-scoper matchingen så navnet ikke treffer en annen sport.",
							"enum": ["football", "golf", "tennis", "f1", "cycling", "chess", "esports", "athletics", "biathlon", "cross-country", "alpine", "nordic", "ski jumping"]
						},
						"notify": {
							"type": "boolean",
							"description": "Gi kalender-påminnelse for dette. Lag/utøvere: på som standard. Turneringer: av med mindre satt til true (f.eks. Tour de France, F1)."
						}
					}
				}
			]
		}
	}
}
