{
  "$schema": "Source of truth — you (the human) edit this. AI never writes here. alwaysTrack entries are { name, aliases, sport, notify }. Teams/athletes notify by default; a tournament only notifies when notify:true.",
  "language": "nb-NO",
  "timezone": "Europe/Oslo",
  "alwaysTrack": {
    "athletes": [
      {
        "name": "Viktor Hovland",
        "aliases": [
          "Hovland"
        ],
        "sport": "golf"
      },
      {
        "name": "Casper Ruud",
        "aliases": [
          "Ruud"
        ],
        "sport": "tennis"
      },
      {
        "name": "Magnus Carlsen",
        "aliases": [
          "Carlsen"
        ],
        "sport": "chess"
      },
      {
        "name": "Aryan Tari",
        "aliases": [
          "Tari"
        ],
        "sport": "chess"
      },
      {
        "name": "Kristoffer Ventura",
        "aliases": [
          "Ventura"
        ],
        "sport": "golf"
      },
      {
        "name": "Håvard Nygaard",
        "aliases": [],
        "sport": "esports"
      }
    ],
    "teams": [
      {
        "name": "Barcelona",
        "aliases": [
          "FC Barcelona",
          "Barça",
          "Barca"
        ],
        "sport": "football"
      },
      {
        "name": "Lyn",
        "aliases": [
          "Lyn Oslo",
          "Lyn Fotball"
        ],
        "sport": "football"
      },
      {
        "name": "100 Thieves",
        "aliases": [
          "100T"
        ],
        "sport": "esports"
      },
      {
        "name": "Uno-X Mobility",
        "aliases": [
          "Uno-X",
          "Uno-X Pro Cycling"
        ],
        "sport": "cycling"
      }
    ],
    "tournaments": [
      {
        "name": "Premier League",
        "aliases": [
          "EPL"
        ],
        "sport": "football"
      },
      {
        "name": "La Liga",
        "aliases": [
          "LaLiga"
        ],
        "sport": "football"
      },
      {
        "name": "UEFA Champions League",
        "aliases": [
          "Champions League",
          "Mesterligaen"
        ],
        "sport": "football"
      },
      {
        "name": "Tour de France",
        "aliases": [
          "TdF"
        ],
        "sport": "cycling",
        "notify": true
      },
      {
        "name": "Masters Tournament",
        "aliases": [
          "The Masters",
          "US Masters"
        ],
        "sport": "golf"
      },
      {
        "name": "PGA Championship",
        "aliases": [],
        "sport": "golf"
      },
      {
        "name": "The Open Championship",
        "aliases": [
          "The Open",
          "British Open"
        ],
        "sport": "golf"
      },
      {
        "name": "US Open Golf",
        "aliases": [
          "U.S. Open Golf"
        ],
        "sport": "golf"
      },
      {
        "name": "Roland-Garros",
        "aliases": [
          "French Open"
        ],
        "sport": "tennis"
      },
      {
        "name": "Wimbledon",
        "aliases": [],
        "sport": "tennis",
        "notify": true
      },
      {
        "name": "F1 World Championship",
        "aliases": [
          "Formula 1",
          "Formula One",
          "Formel 1",
          "F1"
        ],
        "sport": "f1",
        "notify": true
      },
      {
        "name": "FIFA World Cup 2026",
        "aliases": [
          "World Cup 2026",
          "VM 2026",
          "Fotball-VM"
        ],
        "sport": "football"
      }
    ]
  },
  "notify": {
    "leadMinutes": 30
  },
  "interests": [
    "Norske utøvere i internasjonal toppidrett",
    "Premier League — generell oversikt + Liverpool",
    "La Liga med fokus på Barcelona",
    "Norsk fotball — Lyn Oslo i OBOS-ligaen",
    "Golf — PGA Tour og majors, særlig når Hovland spiller",
    "Sjakk på elite-nivå (Magnus Carlsen, Norway Chess, World Championship)",
    "Tour de France — Uno-X og norske ryttere",
    "F1 hele sesongen — kvalifisering + race",
    "CS2 esports KUN når 100 Thieves spiller (rain / Håvard Nygaard) — ingen andre CS2-kamper eller turneringer",
    "Tennis grand slams + Casper Ruud kamper",
    "Vinteridretter (langrenn, skiskyting, alpint) i OL- og verdenscup-perioder"
  ],
  "neverTrack": [
    "Cricket",
    "Rugby",
    "American football",
    "Cycling classics utenom Tour de France",
    "Lower division football i andre land"
  ],
  "notes": "Norwegian timezone, Norwegian-language UI strings preferred. Research agent should think like a Norwegian sports fan — check NRK, TV2, VG, Dagbladet, Nettavisen in addition to international sources."
}
