{
  "$schema": "Source of truth — you (the human) edit this. AI never writes here.",
  "language": "nb-NO",
  "timezone": "Europe/Oslo",
  "alwaysTrack": {
    "athletes": [
      "Viktor Hovland",
      "Casper Ruud",
      "Magnus Carlsen",
      "Aryan Tari",
      "Kristoffer Ventura",
      "Håvard Nygaard"
    ],
    "teams": [
      "Barcelona",
      "Liverpool",
      "Lyn",
      "100 Thieves",
      "Uno-X Mobility"
    ],
    "tournaments": [
      "Premier League",
      "La Liga",
      "UEFA Champions League",
      "Tour de France",
      "Masters Tournament",
      "PGA Championship",
      "The Open Championship",
      "US Open Golf",
      "Roland-Garros",
      "Wimbledon",
      "F1 World Championship",
      "FIFA World Cup 2026"
    ]
  },
  "interests": [
    "Norske utøvere i internasjonal toppidrett",
    "Premier League — generell oversikt + Liverpool",
    "La Liga med fokus på Barcelona",
    "Norsk fotball — Lyn Oslo i OBOS-ligaen",
    "Golf — PGA Tour og majors, særlig når Hovland spiller",
    "Sjakk på elite-nivå (Magnus Carlsen, Norway Chess, World Championship)",
    "Tour de France — Uno-X og norske ryttere",
    "F1 hele sesongen — kvalifisering + race",
    "CS2 esports KUN når 100 Thieves spiller (rain / Håvard Nygaard) — ingen andre CS2-kamper eller turneringer",
    "Tennis grand slams + Casper Ruud kamper",
    "Vinteridretter (langrenn, skiskyting, alpint) i OL- og verdenscup-perioder"
  ],
  "neverTrack": [
    "Cricket",
    "Rugby",
    "American football",
    "Cycling classics utenom Tour de France",
    "Lower division football i andre land"
  ],
  "notes": "Norwegian timezone, Norwegian-language UI strings preferred. Research agent should think like a Norwegian sports fan — check NRK, TV2, VG, Dagbladet, Nettavisen in addition to international sources."
}
